<?xml version="1.0"?>
<?xml-stylesheet href="../stylesheets/layout.xsl" type="text/xsl"?>
<!DOCTYPE lmml PUBLIC "-//DE.UNI-PASSAU.IM//DTD LMML-CS 1.1//EN" "../../resources/dtd//LMML-CS.dtd">
<lmml version="-//DE.UNI-PASSAU.IM//DTD LMML-CS 1.1//EN"><section type="course" title="docere" author="Uwe Spörl" creationTime="08.04.2007" label="docere" topics="docere"><illustration><LMMLtext>lat.: unterrichten, belehren, informieren</LMMLtext></illustration><definition title="docere" label="doceredef"><LMMLtext>Wirkungsprinzip der <referencesLink show="new" type="defines" target="persuasiodef"><referencesLink target="persuasio">persuasio</referencesLink></referencesLink>: Beeinflussung durch Information und Argumentation</LMMLtext></definition><illustration><LMMLtext>Um ein Publikum zu überzeugen, kann sich ein Autor oder Redner auf die jeweilige Sachlage verlassen, die er möglichst nüchtern, klar und präzise aufbereitet und darstellt. Die Sache soll gleichsam ‚für sich selbst sprechen’ – oder zumindest diesen Eindruck erwecken. Denn natürlich ist auch der sachlich informierende Redner parteiisch (etwa bei der Auswahl der Aspekte der jeweiligen Sache); aber er hat Argumente für seine Position und ist daher in der Lage auf Affekterregung (<referencesLink show="new" type="defines" target="moveredef"><referencesLink target="movere">movere</referencesLink></referencesLink>) und entsprechenden <referencesLink target="elocutiomitornatus">ornatus</referencesLink>  zu verzichten.</LMMLtext></illustration></section></lmml>
