<?xml version="1.0"?>
<?xml-stylesheet href="../stylesheets/layout.xsl" type="text/xsl"?>
<!DOCTYPE lmml PUBLIC "-//DE.UNI-PASSAU.IM//DTD LMML-CS 1.1//EN" "../../resources/dtd//LMML-CS.dtd">
<lmml version="-//DE.UNI-PASSAU.IM//DTD LMML-CS 1.1//EN"><section type="course" title="Senkung" author="Sebastian Donat" creationTime="24.03.2008" label="senkung" topics="Senkung"><definition title="Senkung" label="senkungdef"><LMMLtext>Durch das <referencesLink target="metrischesschema"><referencesLink show="new" type="defines" target="metrischesschemadef">metrische Schema</referencesLink></referencesLink> nach Anzahl und/oder Position festgelegte nicht-prominente Silbe im Vers (<referencesLink target="silbenprominenz"><referencesLink show="new" type="defines" target="silbenprominenzdef">Silbenprominenz</referencesLink></referencesLink>). – Senkungen können im konkreten Verstext und im Vortrag ‚realisiert’, d.h. sprachlich umgesetzt werden, dies ist aber keinesfalls zwingend (<referencesLink target="rhythmusdeskonkreteneinzelverses"><referencesLink show="new" type="defines" target="rhythmusdeskonkreteneinzelversesdef">Rhythmus des konkreten Einzelverses</referencesLink></referencesLink>; <referencesLink target="einzelvortrag"><referencesLink show="new" type="defines" target="einzelvortragdef">Einzelvortrag</referencesLink></referencesLink>).</LMMLtext></definition><illustration><LMMLtext><referencesLink type="illustrates" target="beispielsenkungBsp"></referencesLink></LMMLtext></illustration><section type="example" title="Beispiel Senkung" label="beispielsenkungBsp">  <illustration label="beispielsenkungBspIllu"><LMMLtext>Im (aus der englischen Dichtung übernommenen) deutschen Blankvers sind je nach <referencesLink target="kadenzversausgang"><referencesLink show="new" type="defines" target="kadenzversausgangdef">Kadenz</referencesLink></referencesLink> fünf bis sechs Senkungen vorgesehen, und zwar an der 1., 3., 5., 7., 9. und ggf. 11. Position im Vers.</LMMLtext></illustration></section></section></lmml>
