<?xml version="1.0"?>
<?xml-stylesheet href="../stylesheets/layout.xsl" type="text/xsl"?>
<!DOCTYPE lmml PUBLIC "-//DE.UNI-PASSAU.IM//DTD LMML-CS 1.1//EN" "../../resources/dtd//LMML-CS.dtd">
<lmml version="-//DE.UNI-PASSAU.IM//DTD LMML-CS 1.1//EN"><section type="course" title="Theater auf dem Theater" author="Martin Huber, Elisabeth Böhm" creationTime="19.04.2007" label="theateraufdemtheater1" topics="Theater auf dem Theater"><definition title="Theater auf dem Theater" label="theateraufdemtheater1def"><LMMLtext>In der Dramenhandlung verankertes Schauspiel auf der Bühne, das für diese deutende, kommentierende oder selbstreferentielle Funktion übernehmen kann.</LMMLtext></definition><illustration><LMMLtext>Das Theater auf dem Theater, also eine auf der eigentlichen Bühne dargestellte dramatische Handlung, verdoppelt die dramatische Kommunikationsstruktur, indem es diese auf der Bühne reproduziert und so Darsteller wiederum zu Darstellern und Zuschauern macht. Es macht innerhalb der primären eine zweite Fiktionsebene auf. Damit kann die primäre Dramenhandlung kommentiert, auf diese eingewirkt, oder sie in illusionsbrechender Weise als Inszenierung entlarvt werden.</LMMLtext><LMMLtext>Von den Dramen Shakespeares (<formatted style="buchtitel">Hamlet</formatted>, <formatted style="buchtitel">Ein Sommernachtstraum</formatted>) übernahmen die Romantiker (Tieck: <formatted style="buchtitel">Der gestiefelte Kater</formatted>) diese Möglichkeit, im Stück selbstreferentiell auf das dramatische Kommunikationsmodell zu verweisen. Die zusätzliche Fiktionsebene verweist zunächst auf das eigentliche Stück als Fiktion, dann aber auch auf die Möglichkeiten der Wirkung von ‚Theater’ auf ‚Realität’.</LMMLtext><LMMLtext><referencesLink type="illustrates" target="beispieltheateraufdemtheaterBsp"></referencesLink></LMMLtext></illustration><section type="example" title="Beispiel Theater auf dem Theater" label="beispieltheateraufdemtheaterBsp"><quotation booktitle="Hamlet" authorname="William" authorfamily="Shakespeare"><LMMLtext type="br"><formatted style="regie">Die Trompeten ertönen; es folgt die Pantomime</formatted></LMMLtext><LMMLtext type="br"><formatted style="regie">Ein König und eine Königin treten voller Liebesbezeugungen ein, die Königin umarmt ihn und er sie. Sie kniet sich hin und richtet an ihn Gesten heftiger Beteuerung, er hebt sie auf und lehnt seinen Kopf auf ihren Nacken. Er legt sich nieder auf einen Blumenhügel; sie sieht, dass er schläft, und verläßt ihn. Bald kommt ein anderer Mann, nimmt ihm die Krone ab und küßt sie, gießt Gift in die Ohren des schlafenden und verläßt ihn. Die Königin kehrt zurück, findet den König tot vor und gibt Anzeichen leidenschaftlicher Trauer; der Giftmörder kommt mit drei oder vier Statisten wieder herein und scheint ihren Schmerz zu teilen; der Leichnam wird weggetragen. Der Giftmörder wirbt um die Königin mit Geschenken; für eine Weile scheint sie abweisend, nimmt aber am Ende seine Liebe an.
Beide gehen ab.
</formatted></LMMLtext><LMMLtext type="br">OPHELIA: Was bedeutet dies, mein Prinz?</LMMLtext><LMMLtext type="br">HAMLET: Je nun, dies ist schleichende Schurkerei, es bedeutet Böses.</LMMLtext></quotation><illustration label="beispieltheateraufdemtheaterBspIllu"><LMMLtext>Auf der Handlungsebene sind Schauspieler ins Schloß gekommen. In der Pantomime vor dem eigentlich gezeigten Schauspiel, das allerdings unterbrochen wird, kündigen die Schauspieler dem dänischen Hof die Dramenhandlung an, die dem entspricht, was Hamlet vom Geist über den Tod seines Vaters gehört hat.</LMMLtext></illustration></section></section></lmml>
