<?xml version="1.0"?>
<?xml-stylesheet href="../stylesheets/layout.xsl" type="text/xsl"?>
<!DOCTYPE lmml PUBLIC "-//DE.UNI-PASSAU.IM//DTD LMML-CS 1.1//EN" "../../resources/dtd//LMML-CS.dtd">
<lmml version="-//DE.UNI-PASSAU.IM//DTD LMML-CS 1.1//EN"><section type="course" title="Alliteration" author="Uwe Spörl" creationTime="08.04.2007" label="alliteration" topics="Alliteration"><definition title="Alliteration" label="alliterationdef"><LMMLtext>Klangfigur: gleicher Anlaut aufeinanderfolgender Wörter </LMMLtext></definition><illustration><LMMLtext>Die Alliteration ist eine Klangfigur, bei der die Anlaute (und damit in der Regel auch die Anfangsbuchstaben) zweier oder mehrerer aufeinanderfolgender Wörter übereinstimmen.</LMMLtext><LMMLtext>Die antike rhetorische Tradition nennt diese Klangfigur <formatted style="hervorhebung">Homoioprophoron</formatted> (griech. etwa: das, was das Gleiche vor sich her trägt).</LMMLtext><LMMLtext>Die Alliteration kann die Zusammengehörigkeit miteinander verknüpfter Ausdrücke unterstreichen. Sie bewirkt aber insbesondere eine größere Einprägsamkeit, weshalb sie häufig in Werbetexten (z. B. „Spiel, Spaß und Spannung“ oder „Mars macht mobil“) und in pointierten Wendungen (z. B. „Land und Leute“ oder „veni vidi vici“) – auch in poetischen/literarischen Texten („Röslein, Röslein, Röslein rot“) – verwendet wird. Zudem strukturiert die Alliteration als Klangfigur den Text auf der phonologischen und musikalischen Ebene.</LMMLtext></illustration></section></lmml>
