<?xml version="1.0"?>
<?xml-stylesheet href="../stylesheets/layout.xsl" type="text/xsl"?>
<!DOCTYPE lmml PUBLIC "-//DE.UNI-PASSAU.IM//DTD LMML-CS 1.1//EN" "../../resources/dtd//LMML-CS.dtd">
<lmml version="-//DE.UNI-PASSAU.IM//DTD LMML-CS 1.1//EN"><section type="course" title="Song" author="Martin Huber, Elisabeth Böhm" creationTime="09.09.2007" label="song" topics="Song"><definition title="Song" label="songdef"><LMMLtext>besondere Form des Liedes, im dramatischen Kontext von Brecht für das epische Theater funktionalisiert.</LMMLtext></definition><illustration><LMMLtext>Obwohl schon in den 1920er Jahren im Kabarett der Ausdruck Song für bestimmte Gesangsnummern verwendet wird, die sich an anglo-amerikanische Vorbilder halten und sich bewusst vom Kunstlied distanzieren, prägt besonders Brecht diesen Begriff, indem er ihn in seinen theoretischen Schriften verwendet. Er nennt die Gesangsnummern so, die in seinen Stücken eingesetzt werden. Dabei dienen sie vor allem der <referencesLink target="veffekt"><referencesLink show="new" type="defines" target="veffektdef">Verfremdung</referencesLink></referencesLink>, indem sie durch Form und Präsentation aus dem üblichen Handlungsschema herausfallen und außerdem oft deutlich politische Inhalte transportieren. Mit Komponisten wie Kurt Weill und Hanns Eisler zusammen gestaltet Brecht Lieder, die im Drama aber auch jenseits des handlungsspezifischen Kontexts rezipiert wurden.</LMMLtext></illustration></section></lmml>
