<?xml version="1.0"?>
<?xml-stylesheet href="../stylesheets/layout.xsl" type="text/xsl"?>
<!DOCTYPE lmml PUBLIC "-//DE.UNI-PASSAU.IM//DTD LMML-CS 1.1//EN" "../../resources/dtd//LMML-CS.dtd">
<lmml version="-//DE.UNI-PASSAU.IM//DTD LMML-CS 1.1//EN"><section type="course" title="Historische Anforderungen" author="Martin Huber, Elisabeth Böhm" creationTime="09.09.2007" label="historischeanforderungen" topics="Historische Anforderungen"><illustration><LMMLtext>In der Geschichte des Dramas wurden immer wieder verschiedene Anforderungen an dessen Entwicklung gestellt. Denn je nach der Funktion, die das Theater in einem bestimmten Kontext einzunehmen hatte, musste es formalen und inhaltlichen Ansprüchen genügen. <referencesLink target="staendeklausel"><referencesLink show="new" type="defines" target="staendeklauseldef">Ständeklausel</referencesLink></referencesLink> und <referencesLink target="fallhoehe"><referencesLink show="new" type="defines" target="fallhoehedef">Fallhöhe</referencesLink></referencesLink> können als Beispiele gut illustrieren, wie sich bestimmte Vorstellungen von Gesellschaft und Personalität in der Theaterästhetik niederschlagen.</LMMLtext></illustration></section></lmml>
