<?xml version="1.0"?>
<?xml-stylesheet href="../stylesheets/layout.xsl" type="text/xsl"?>
<!DOCTYPE lmml PUBLIC "-//DE.UNI-PASSAU.IM//DTD LMML-CS 1.1//EN" "../../resources/dtd//LMML-CS.dtd">
<lmml version="-//DE.UNI-PASSAU.IM//DTD LMML-CS 1.1//EN"><section type="course" title="Indirekte Gedankenrede" author="Fotis Jannidis, Uwe Spörl, Katrin Fischer" creationTime="30.07.2005" label="indirektegedankenrede" modifiedTime="27.10.07"><definition title="Indirekte Gedankenrede" label="indirektegedankenrededef"><LMMLtext>Erzählerische Gedankenwiedergabe in der 3. Person Präsens Konjunktiv (bei Ich-Erzählung: in der 1. Person für das erlebende Ich), mit der Möglichkeit kommentierender Einmischung, in vollständiger Syntax ohne Anführungs-, Ausrufe- und Fragezeichen.</LMMLtext><LMMLtext>In indirekter Gedankenrede bleibt zwar der Inhalt der Gedanken der Figur erhalten, nicht 
jedoch ihr Wortlaut, da das Gesagte einem anderen Sprecher, dem Erzähler, als Inhalt eines „dass“-Satzes im Konjunktiv zugeordnet wird.</LMMLtext></definition><illustration><LMMLtext><referencesLink type="illustrates" target="beispielindirektegedankenredeBsp"></referencesLink><referencesLink type="exercises" target="uebungzurindirektengedankenredeUeb"></referencesLink></LMMLtext></illustration><section type="example" title="Beispiel indirekte Gedankenrede" label="beispielindirektegedankenredeBsp"><quotation booktitle="Die Wahlverwandtschaften (16. Kapitel)" authorname="Jahann Wolfgang" authorfamily="von Goethe"><LMMLtext>Er faßte sich; er dachte, <formatted style="hervorhebung">daß</formatted> es ihm doch möglich <formatted style="hervorhebung">sei</formatted>, jeden Augenblick zurückzukehren und durch die Entfernung gerade seinen Wünschen näher zu kommen.</LMMLtext></quotation><illustration label="beispielindirektegedankenredeBspIllu"><LMMLtext>Die Konjunktion „daß“ in Verbindung mit dem Konjunktiv lässt deutlich erkennen, dass die Gedanken nicht wörtlich wiedergegeben werden, sondern in die <referencesLink show="new" type="defines" target="indirektegedankenrededef">indirekte Gedankenrede</referencesLink> transponiert sind.</LMMLtext></illustration></section><exercise label="uebungzurindirektengedankenredeUeb" title="Übung zur indirekten Gedankenrede" topics="multiplechoice"><task type="textbeispiel"><quotation booktitle="Wilhelm Meisters Lehrjahre (11. Kapitel)" authorname="Johann Wolfgang" authorfamily="von Goethe"><LMMLtext>So groß war seine Leidenschaft, so rein seine Überzeugung, er handle vollkommen recht, sich dem Drucke seines bisherigen Lebens zu entziehen und einer neuen, edlern Bahn zu folgen, daß sein Gewissen sich nicht im mindesten regte, keine Sorge in ihm entstand, ja daß er vielmehr diesen Betrug für heilig hielt. Er war gewiß, daß ihn Eltern und Verwandte in der Folge für diesen Schritt preisen und segnen sollten, er erkannte den Wink eines leitenden Schicksals an diesen zusammentreffenden Umständen.</LMMLtext></quotation></task><task type="fragestellung"><LMMLtext> Hat man es hier mit<referencesLink show="new" type="defines" target="indirektegedankenrededef"> indirekter Gedankenrede</referencesLink>, mit <referencesLink show="new" type="defines" target="erlebtegedankenrededef">erlebter Gedankenrede</referencesLink> oder einem <referencesLink show="new" type="defines" target="bewusstseinsberichtdef">Bewusstseinsbericht</referencesLink> zu tun?</LMMLtext></task><task type="alternative" target="uebungzurindirektengedankenredeL1"><LMMLtext>Mit <referencesLink show="new" type="defines" target="indirektegedankenrededef">indirekter Gedankenrede</referencesLink>, erkennbar am wiederholten Auftreten der Konjunktion „dass“.</LMMLtext></task><solution label="uebungzurindirektengedankenredeL1" true="false"><LMMLtext> Die Konjunktion „dass“ folgt hier nicht auf einleitende Verben des Sagens und Meinens und zieht auch nur in einem Fall den Konjunktiv. Sie indiziert somit keine <referencesLink show="new" type="defines" target="indirektegedankenrededef">indirekte Gedankenrede</referencesLink>.</LMMLtext></solution><task type="alternative" target="uebungzurindirektengedankenredeL2"><LMMLtext> Hier liegt eindeutig <referencesLink show="new" type="defines" target="erlebtegedankenrededef">erlebte Gedankenrede</referencesLink> vor, weil man das Gefühl hat, die Gedanken der Figur selbst zu erleben.</LMMLtext></task><solution label="uebungzurindirektengedankenredeL2" true="false"><LMMLtext>Mit der Partizipation an den Bewusstseinsvorgängen von Figuren hat der Begriff <referencesLink show="new" type="defines" target="erlebtegedankenrededef">erlebte Gedankenrede</referencesLink> nur sehr bedingt etwas zu tun. Wir haben es hier zwar mit einer Gedankenwiedergabe in der 3. Person Präteritum Indikativ mit Innensicht zu tun, haben aber zusätzlich Verben des Fühlens („dass sich sein Gewissen regte“, „für heilig hielt“ „Er war gewiß“), die auf die Vermitteltheit der Gedankenwiedergabe aufmerksam machen.</LMMLtext></solution><task type="alternative" target="uebungzurindirektengedankenredeL3"><LMMLtext>Die ganze Passage ist ein <referencesLink show="new" type="defines" target="bewusstseinsberichtdef">Bewusstseinsbericht</referencesLink>.</LMMLtext></task><solution label="uebungzurindirektengedankenredeL3" true="true"><LMMLtext>Bestimmte Verben und Formulierungen („dass sich sein Gewissen regte“, „für heilig hielt“ „Er war gewiß“) weisen den Leser darauf hin, dass wir es hier  mit einem Erzähler zu tun haben, der uns die Gedanken einer Figur berichtet.</LMMLtext></solution></exercise></section></lmml>
