<?xml version="1.0"?>
<?xml-stylesheet href="../stylesheets/layout.xsl" type="text/xsl"?>
<!DOCTYPE lmml PUBLIC "-//DE.UNI-PASSAU.IM//DTD LMML-CS 1.1//EN" "../../resources/dtd//LMML-CS.dtd">
<lmml version="-//DE.UNI-PASSAU.IM//DTD LMML-CS 1.1//EN"><section type="course" title="Fallhöhe" author="Martin Huber, Elisabeth Böhm" creationTime="09.09.2007" label="fallhoehe" topics="Fallhöhe"><definition title="Fallhöhe" label="fallhoehedef"><LMMLtext>Kategorie der Dramentheorie, die besagt, dass der Fall eines Helden umso eindringlicher empfunden wird, je höher sein sozialer und moralischer Rang vorher war.</LMMLtext></definition><illustration><LMMLtext>Die Fallhöhe ist eng mit der Ständeklausel verknüpft und markiert nochmals den Zusammenhang von moralischem und sozialem Stand nach klassizistischem Verständnis. Nur der Fall eines hochstehenden, moralisch gefestigten Helden könne die gewünscht Wirkung beim Publikum erzielen, heißt es bei Aristoteles. Allerdings findet sich dort auch die Forderung nach einem Fehler des Helden, so dass dessen Fall nicht gänzlich unmotiviert und unverdient erscheint. Jedoch ist es die Tiefe des Sturzes sowie das Verhalten des Untergehenden, die eine entsprechende Publikumswirkung vermitteln können. Der Zusammenhang von sprachlichem Stil, gezeigter Gesinnung und Schwere des Konflikts darf auch hier nicht unbeachtet bleiben. </LMMLtext><LMMLtext>Mit zunehmender Modernisierung des Dramenverständnisses und Wegfall der Ständeklausel verliert auch die Fallhöhe ihre Bedeutung, da auch Figuren niederen Stands in Konflikten gezeigt werden bzw. die Probleme der Reichen und des Adels kaum noch von denen der Bürger unterschieden werden können (vgl. Schnitzler).</LMMLtext><LMMLtext><referencesLink type="illustrates" target="beispielfallhoeheBsp"></referencesLink></LMMLtext><LMMLtext>Inhaltlich und stilistisch lassen sich diese Anforderungen in <referencesLink target="hamartia"><referencesLink show="new" type="defines" target="hamartiadef">Hamartia</referencesLink></referencesLink>, <referencesLink target="intrige"><referencesLink show="new" type="defines" target="intrigedef">Intrige</referencesLink></referencesLink> und <referencesLink target="pathos"><referencesLink show="new" type="defines" target="pathosdef">Pathos</referencesLink></referencesLink> finden, die sich zwar auch historisch veränderten, aber bis ins 19. Jahrhundert zentrale Positionen in den Dramen und ihrer theoretischen Reflexion einnahmen.</LMMLtext></illustration><section type="example" title="Beispiel Fallhöhe" label="beispielfallhoeheBsp"><quotation><LMMLtext>I Sophokles: König Ödipus</LMMLtext><LMMLtext type="br">Personen:</LMMLtext><LMMLtext type="br">ÖDIPUS, König von Theben</LMMLtext><LMMLtext type="br">PRIESTER des Zeus</LMMLtext><LMMLtext type="br">KREON, Bruder der Königin</LMMLtext><LMMLtext type="br">TEIRESIAS, ein blinder Seher</LMMLtext><LMMLtext type="br">IOKASTE, Königin</LMMLtext><LMMLtext type="br">BOTE aus Korinth</LMMLtext><LMMLtext type="br">HIRTE des Laios</LMMLtext><LMMLtext type="br">DIENER</LMMLtext></quotation><quotation><LMMLtext>II Gotthold Ephraim Lessing: Emilia Galotti</LMMLtext><LMMLtext type="br">Personen:</LMMLtext><LMMLtext type="br">EMILIA GALOTTI</LMMLtext><LMMLtext type="br">ODOARDO und CLAUDIA GALOTTI, Eltern der Emilia</LMMLtext><LMMLtext type="br">HETTORE GONZAGA, Prinz von Guastalla</LMMLtext><LMMLtext type="br">MARINELLI, Kammerherr des Prinzen</LMMLtext><LMMLtext type="br">CAMILLO ROTA, einer von des Prinzen Räten</LMMLtext><LMMLtext type="br">CONTI, Maler</LMMLtext><LMMLtext type="br">Graf APPIANI</LMMLtext><LMMLtext type="br">Gräfin ORSINA</LMMLtext><LMMLtext type="br">ANGELO und einige Bediente</LMMLtext></quotation><quotation><LMMLtext>III Schnitzler: Liebelei</LMMLtext><LMMLtext type="br">Personen:</LMMLtext><LMMLtext type="br">HANS WEIRING, Violinspieler am Josefstädter Theater</LMMLtext><LMMLtext type="br">CHRISTINE, seine Tochter</LMMLtext><LMMLtext type="br">MIZI SCHLAGER, Modistin</LMMLtext><LMMLtext type="br">KATHARINA BINDER, Frau eines Strumpfwirkers</LMMLtext><LMMLtext type="br">LINA, ihre Tochter</LMMLtext><LMMLtext type="br">FRITZ LOBHEIMER und THEODOR KRAUSE, junge Leute</LMMLtext><LMMLtext type="br">EIN HERR</LMMLtext></quotation>
						</section></section></lmml>
